{
  "id": "force.mad-cat-lance",
  "name": "Mad Cat Lance",
  "faction": "Clan / Inner Sphere mercenaries",
  "color": "#c27a2c",
  "bvBudget": 7500,
  "units": [
    {
      "slot": "u1",
      "mech": "mech.mad-cat-mk-ii.base",
      "pilot": "pilot.generic-alpha"
    },
    {
      "slot": "u2",
      "mech": "mech.rakshasa.mdg-1b",
      "pilot": "pilot.generic-bravo",
      "skills": {
        "gunnery": 5,
        "piloting": 5
      }
    },
    {
      "slot": "u3",
      "mech": "mech.eris.ers-2h",
      "pilot": "pilot.generic-charlie",
      "skills": {
        "gunnery": 5,
        "piloting": 5
      }
    },
    {
      "slot": "u4",
      "mech": "mech.hollander.bzk-g1",
      "pilot": "pilot.generic-delta",
      "skills": {
        "gunnery": 5,
        "piloting": 5
      }
    }
  ],
  "source": {
    "ref": "ours",
    "note": "skirmish preset, M7 balance: Rakshasa MDG-1B, Eris ERS-2H, Hollander G1 at 5/5 behind the lead. Adjusted BV 7,001 vs Regent 6,732 (4.0%). Bench easy v easy, 16 games per side order, seed 3: Mad Cat 14, Regent 17, 1 draw"
  },
  "verify": [
    {
      "path": "",
      "note": "uses stock variants (Rakshasa MDG-1B, Eris ERS-2H, Hollander BZK-G1) in place of unknown box variants",
      "status": "standIn"
    }
  ]
}
